{
  "$schema": "http://json-schema.org/draft-07/schema#",
  "title": "DistributeVueLib Registry Schema",
  "description": "Schema for the registry/source.json file, which defines all components and utilities in the Distribute Vue Library.",
  "type": "object",
  "properties": {
    "name": {
      "type": "string",
      "description": "The unique name of the component library."
    },
    "version": {
      "type": "string",
      "description": "The version of the component library."
    },
    "homepage": {
      "type": "string",
      "format": "uri",
      "description": "URL to the homepage of the component library."
    },
    "items": {
      "type": "array",
      "description": "An array of all distributable items (components, functions).",
      "items": {
        "$ref": "./registry-item.schema.json"
      }
    }
  },
  "required": ["name", "version", "items"]
}
